44920,"Не мрачный кипарис, ветвь масличну приносят."
44922,"Кровопролития несчастнейших творцов,"
44968,Когда мы убежать от зла не можем сами?
44969,"Оставим, смертны быв, грехи казнить богам."
44972,Страдающих по них сокровников несчастных.
45023,Чтоб в жертву их сестру мучениям предать
45026,На мрачных тень его брегах должна скитаться!
45029,Чем самовидицей такого быть позора.
45050,"Разишь слух сына тем, что лют его родитель."
45051,Заставила меня страдать стократно злей
45054,"Нет, смерть твою Эмон претерпит разве мертвый."
45100,Колико я страдаю!
45106,"Но коль устав Креонт дал гневом двигнуть злым,"
45165,"Коль есть тебе враги, разить их укажи."
45168,"Не в лютый бой входить, не лить алкаю кровь, —"
45187,Свой долг она творит: се те часы настали.
45209,Мне счастье за нее смерть лютую снести.
45254,И смерть мне дать моих злодействий ты не жди.
45270,"Рвусь тщетно мест бежать, был в коих лютый бой."
45278,И звуки гибельны войны толико злой
45292,"Туда ж за ними, зрю, влеком Эмон, страдая…"
45293,"Почто вы, фурии, оставивши меня,"
45295,"В презренье моего разительного стона,"
45298,С сим воздухом вдыхать лютейший в сердце ад.
45300,"И, братиев влача, Эмона хоть оставьте…"
45310,"Смятенье утоли, мечтание губя."
45319,"Нет гибелей тебе, когда Эмон с тобой;"
45320,"Чтоб вред тот был при нем, кой мысль твою смущает,"
45420,Когда в преступниках царевна и мой сын!
45459,"Но днесь я зрю, что ты движений подлых раб,"
45490,"И, сколько ты ко мне, к тебе был столько ж злобен,"
45492,"И сына своего в преступнике забыв,"
45555,Сколь душу мысль сия ужасна раздирает!
45560,Но что является? о ужас! о позор!
45568,Не может низостей мученьем причинить.
45569,"Разить — ему позор, мне слава — всё сносить."
45573,Что злая над твоей напасть висит главой.
45596,"Свидетелем став днесь позора твоего,"
45627,Снедающий тебя чужд слабости мне яд.
45661,Смерть люту от меня в Эмоне удали.
45667,"Оковы тяжкие, темницы мрачной своды,"
45675,"Коль мне б судил он смерть всем общу, не позорну;"
45693,Без ужаса пренесть жестоких бедствий связь
45699,"И смертию в сей час смерть низку предварила,"
45701,Но чувствий вся болезнь к сей крайности мала:
45705,Смерть медлит; я ее по степеням сношу…
45706,Почто ж меня Эмон несчастную оставил?
45734,"Тронись теперь моим, тронись смертельным страхом"
45736,"Не презри стонов ты страдающей души,"
45740,Я смерти не могу поносныя снести…
45742,"Уйдите, чтоб не зреть предмета ей плачевна."
45748,Виновница всех зол! преслушница царю!
45749,"Увидь ты ужас весь, которым я горю."
45750,Сей ужас твоего плодом есть преступленья.
45779,Все чувствия мои злодейство ненавидят.
45802,"Дивишься, не робка что, зря я дух твой зверский."
45803,Невинные сердца пред смертью самой дерзки.
45805,Уж время за нее пришло тебе страдать.
45830,Когда долг подданных у них теперь в забвенье.
45833,И ваш ли долг дела монарши здесь судить?
45850,"Смерть хладну видя в ней, сам леденею весь…"
45864,"Вместилище став мук, бессилен жизнь изринуть…"
45874,Виновник стал сего кровавого ручья.
45881,"А ты, родитель мой! на сей смотря позор,"
45887,"Но боги злобы сей без казни не оставят,"
45894,В тиране сем кого? родителя я зрю!..
45897,И от тебя ль сносить упреки должен я?
45901,"Зри, смерти зрак на сем челе напечатлен."
45907,Спокойство на ее вкушу я мрачном лоне…
45910,С лица ее в себя смерть дайте мне всосать.
45940,"И, может быть, тебя б с царевной ненавидел,"
45941,Плачевной вашей коль кончины б сей не видел.
45946,И мучивший меня в нем гнева огнь угас…
46084,"Подлоги, грабежи, разбои разна рода,"
46118,"Что и ошибкой он дел прямо не вершил,"
46254,"Навычки умягчить развратны и суровы,"
46315,Или и ты меня в печали оставляешь?
46730,"Всё душу перегнуть боится сей провал,"
46767,И убитый?
46813,А проигрыш его не должен уж тревожить.
46817,"И в уголовной был, там в нижнюю расправу,"
47080,"Во всяку входит дрянь, кто б с просьбой ни втесался."
47112,"Сам черт, знать, научил проклятых жить судей"
47126,"Ждать часик у ворот, хоть грязь и по колена,"
47270,"Наумыч, не ударь ты в грязь лицом, смотри!"
47272,"А я боюсь, что он вельми нас всех обидит."
47320,"Итак, вы видите, что явный тут обман"
47495,Вот темна пароли.
47519,"Глух звук, — не слышу я."
47531,Злой случа́й похитить может.
47596,"Хлапа я что хлопну, то убью."
47691,"Вдов видеть, стариков и нищенских сирот,"
47717,"Убить меня, с моим врагом соединиться?"
47886,"Пустыми страхами и вздорной чепухою,"
48003,"Нет, это страх пустой, поверьте мне, божуся;"
48016,Вот на! Так тут ваш страх лишь чепуха пустая.
48035,"Чье спорное село, без дальних всех расправ,"
48092,"Ино, чтоб не зайтить в таку глухую пущу."
48271,"Чужое прозвище бесправно впредь носить,"
48314,Он долгом счел служить; и жертвовать собой.
48344,"Поди прочь: знать, душа уж к ней твоя пристрастна;"
48374,В том нет и малого сомненья.
48493,Велеть нас всех судить порядком уголовным?
48500,"Ограбить, разорять, страмить нас, убивать!"
48752,(почти падая с пьянства)
48906,Но брать заказы нам запрещено.
48922,"Хоть ты убей меня! Всё мода, мода!"
49025,Фабрициус! Я умер! Я убит!
49138,И у него жестокая холера.
49143,Красотка эта стала старой ведьмой.
49215,"Создатель, что за дикая мазня?!"
49284,Рисуете каких-то грязных типов.
49298,Пустое: кашель.
49386,"Боясь измены, не сказали мы"
49424,Но почему-то с крайне кислой миной.
49475,Что нищего на перекрестке грабит!
49499,Что Саския стоит у двери смерти.
49530,"Ты издеваешься, дурак!"
49549,Под адский грохот пушек Нисверслуйса.
49555,В твоем кругу: все больше грязной черни.
49595,"Колоколов глухая перекличка,"
49623,Не принял бы: я живописец нищих.
49667,А умер в обществе головорезов.
49670,На неразумного свой гнев умерьте!
49673,Молчи о смерти! Ведь за каждый миг
49687,Ты скуп! Ты отказался мне купить
49772,Что трогать слабых беззащитных дам -
49870,"Несчастной этой, ни кровопусканья."
50017,"Позор ему, стрелки!"
50018,Позор! Позор!
50115,На нас клевещут злые языки.
50152,"За горем горе! Господи, за что же?"
50159,"Ты плачешь, Стоффельс?"
50161,Я вижу: плачешь!
50181,"Прощались с ней... Ты снова плачешь,"
50201,"Опять ты плачешь, Стоффельс? Что с тобою?"
50203,"Всё от ""дурной приметы""? Ты всё та же!"
50253,Меня пугают муки ада.
50320,"Вы мне читать мешаете!.. ""Ответчик,"
50353,"""Пусть голодом язвим и мучим страхом,"
50358,Везде гоним. Проклятие ему
50438,Я слышал - и французская болезнь
50479,Попробуй взять: в тюрьму пойдешь за кражу!
50517,Согреть меня в беде и в униженье...
50705,И чванных дураков и знатных воров:
50734,"Я умер бы, больной, гонимый, нищий."
50742,На мне лежит проклятье отлученья.
50754,"Не плачь, дитя. Забудь про всё, что было."
50804,"Все краски старости, все краски смерти."
50806,"Лохмотья, ветошь, грязные стаканы..."
50831,И разыграл такую злую шутку?
50834,"Я одинок и болен, слаб и сир,"
50873,Я до смерти покойников боюсь!
50946,Как бьется сердце! Уж не смерть ли это?
51006,- Тс! Не плачь!
51011,"А то ошибка вышла тут, возможно:"
51026,Не умирал. Скорей его врагов
51058,Фабрициус подносит к мольберту свечу. На полотне изображена старая толстая бюргерша и рядом с ней - обезьяна. Все изумленно смотрят на картину. Бюргер отступает.
51090,"Пораженный, Рембрандт отступает."
51104,"Саския в домашнем платье, и чепце. Очень бледна, слаба. Идет, держась за стены."
51114,(плача)
51124,"Комната первой картины. Посреди на мольберте картина ""Ночной дозор""Групповой портрет офицеров корпорации стрелков. На нем среди беспорядочной толпы стрелков изображена карлица.}, Рембрандт кладет на нее последние мазки. Флинк смотрит."
51200,(плача)
51202,(плача)
51251,"Комната с убогой обстановкой в гостинице. На стене висит этюд ""Туша вола"". Постаревший Рембрандт сидит перед мольбертом с недоконченным автопортретом. На постели лежит красный тюльпан."
51421,"Я жалостлив, до ссор я очень не охотен,"
51457,"Я слышал, по уши он врютился в долги?"
51567,"И кто без чина свой проводит темный век,"
51614,"Быть может столько подл и духом унижен,"
51666,Но много денег я еще в долгах имею.
51704,"И душ две тысячи, и денег страшна бездна."
51769,Вы не ударьтеся бесчинно в грязь лицом.
51879,"Могу сказать вам то, что есть вас старе девки."
51883,Коль сердце бы мое печалью не терзалось;
51942,"Не плачь, Милена."
52138,"Хоть долг и не безмерен,"
52219,То сущая измена
52220,И злая клевета!
52309,"Вот в этом платье дав ему я вид измены,"
52336,Так нет сомнения о лютой сей измене?
52344,"Не трушу, а бегу я прочь из сожаленья."
52414,"Чтоб шу́том вашим быть в мучении моем,"
52435,С каким презреньем к нам она отсель ушла!
52521,"Кто спорит с дураком, тот будет сам дурак."
52522,Я счастью вашему нимало не мешаю;
52539,"Какой-нибудь дурак, невежа и скотина!"
52561,"Изволит побранить, а после не оставит."
52710,Убила ты бобра.
52712,"И наглый с глупостей людских он пошлин сборщик,"
52734,Вот тут-то надобно ужом и жабой лезть.
52797,"И потому уже, что ты толико злобен,"
52870,"Замир жестокий! чем виновна пред тобой,"
52998,"Впоследок в монастырь от бед моих сокрыться,"
53065,"Он против вас груб очень станови́тся,"
53094,"Я не хочу, чтоб вы убиты были мной."
53143,"То смел он обижать, а драться сердца нету..."
53218,Обманы низкие и с наглостью такой...
53253,"Забудьте этот вздор, я должен вас просить..."
53520,Уж сколько времени за долгом я скитаюсь.
53562,"Молчи! ты страшный плут, ты с нас дерешь безбожно."
53613,"Не сделай мне вреда: ты видишь, я женюся."
53635,Чтоб долга на тебе изволил подождать
54126,"И, гнева вашего злодейство не боясь,"
54154,"Тирана лютого, зри: пламень и мечи"
54164,"Чтоб злейшему они тирану были жертвы,"
54188,"Чего ж страшиться мне, коль смерти не страшуся."
54205,"Когда предерзкий раб, Мал, хитрости посредством,"
54225,"От Мала лютого опасности предзря,"
54244,"Плененна, в бедности оставленна от всех,"
54254,Их страха мраз объял; тираном устрашенны
54276,"Но се тиран идет, скрывай себя пред ним"
54319,Оставь бесплодное отмщенья упованье:
54359,"Супругой став, меня хоть будешь ненавидеть,"
54376,Чтобы избегнути от рока смертно злого
54382,"Мой сын, несчастный сын, в пустынях и лесах,"
54435,"Зри, варвар, мстительны вокруг свещи их мрачны,"
54438,"Но Ольгу отпусти во диких жить лесах,"
54439,"Там, сына зря, от всех оставлении и нища, —"
54475,Остаток истребить противного мне племя
54500,"И, в здешний град входя, во мрак низо́йдут гроба."
54508,"Отечеству, тебе врагом неблагодарным;"
54510,Что к смерти уж давно законом осужден.
54518,Доныне Мал еще им кажется тиран.
54533,"Скажи, Мирвед, кто был несчастный в узах там,"
54534,"Которого хотел тиран увидеть сам,"
54538,"Убийством виноват, он кровью обагрен."
54555,"Убийством, грабежом округа здешни полны,"
54562,"Умален лишь судьбой, — но равен мне во всем."
54568,"Сего несчастного, ко смерти осужденна."
54571,"В отчаянья, в тоске, крушася и страдая,"
54599,"Несчастный Святослав, бедами наученный,"
54606,Ничто ту ненависть не может одолеть:
54622,"Несчастный, подойди, отторгни страха муку..."
54628,"Скажи, чию ты жизнь, жестокий, прекратил?"
54665,"Влеку к водам, чтоб в них невольный грех сокрыть, —"
54675,"Твои черты... Игра жестокого случа́я,"
54677,"Неправедно его Мал к смерти осудил,"
54713,"Почто ж несчастного оставил ты отца,"
54742,"Он в рабстве, может быть, жестоку сносит власть"
54747,Для рода княжеска какая участь злая!
54751,"Всяк, Мала лютого гордыню злую множа,"
54756,"Забывши клятву, долг ко княжеской вдовице,"
54761,"Хотя несчастен я, родяся в нищете,"
54764,И все несчастны мы.
54773,"Он мертв, от всех забыт — и варвар здесь владетель!"
54795,"Мой сын! несчастный сын!.. Мирвед, твой зрак бледнеет."
54799,"Сраженны вестью сей, все Ольгу оставляют."
54807,Насытило свое сей смертью сердце злое?
54808,"Сей злобный юноша, коварный сей злодей,"
54827,"Оружье Игоря, супруга меч несчастна,"
54833,"То был Волод, то был несчастный вождь его, —"
54834,То сам тиран сказал...
54846,"Услышав, что погиб несчастный Святослав,"
54857,Напрасно в Мале ты злодея ненавидишь:
54863,Ко казни злейшия им будет осужден.
54866,"Хочу, чтоб сей рукой убийца мертв упал,"
54867,Чтоб Мал за сына казнь во власть мою предал;
54887,"Забыв, что сын погиб, тирану быть женой,"
54889,Уж горести сносить не стало больше мочи:
54908,Уж смерти злой его закрыла мрачна дверь.
54921,"Без князя все меня, все будут ненавидеть..."
54926,Вопль слышу жалостный; увы! всё здесь страдает.
54936,Оставь желание ты ей теперь скучать;
54946,"Несчастна князя прах в гробнице сей лежит,"
54949,"О, прах несчастного владыки моего!"
54950,Стократ несчастнее супруга днесь его.
54953,"Что слышу! сын ее, несчастный Святослав!.."
54954,"Убийца злобнейший, его в пути поправ,"
54970,"Он, слыша, что погиб несчастный Ольги сын,"
54972,"Рыдает, слезы льет, страдает и крушится, —"
54985,"И что я сделала, несчастная, тебе?"
54989,"Поверь, несчастные не все бесчестны суть, —"
55025,Ты сына моего убил...
55069,За сына своего несчастного отмщала.
55092,"Не знаючи его, его ты убивала,"
55097,Представить повелел перед себя тиран.
55100,Несчастна.
55131,"Когда б супругом мне сей злой тиран нарекся,"
55157,Из лютых челюстей злой смерти и несытой
55164,"Умолкните, тиран уже сюда вступает."
55167,Скрывай себя перед гонителем его.
55184,Докончат жизнь его злодеи в злом мученьи;
55193,"В моих, и чаю я, что мук несносных страх"
55195,Жестокий... Ах! почто к мученью чрезвычайну
55219,Тиранам лишь одним толь свойственну мученью.
55227,"Оставь, ты зришь моих напастей страшну связь,"
55284,Отец несчастного сего
55291,"Хотяща поразить, смерть Ольга отвращает."
55306,"Кровь мою несчастную, губя,"
55309,Тиран ли ты иль князь? Когда ты здесь тиран —
55315,"Я праведно убил напавшего злодея,"
55322,"А винен только ты, злой варвар и тиран."
55332,"Мой сын, несчастный сын, князей остаток племя,"
55333,"Неся претягостно судьбины злобной бремя,"
55338,"И ярость ты свою на жалость пременяешь,"
55345,Жестокий! ах! отдай... Не хочешь мне внимать.
55352,Жестокий! он мой сын!
55365,"Злодей, обманом мать отчаянну виня!"
55380,"Окончи прежде ты, тиран, мою жизнь люту!"
55387,"Хоть верь мучениям, в которых я страдаю,"
55392,"Жестокий! вот он здесь, а ты его сражаешь."
55405,Чтоб злобного сего тирана презирать.
55413,"Коль должно погибать, без страха смерть приму"
55448,Прими меня вождем в твоей толь темной доле.
55471,"Сразив тя, князем я иль, мертв, рабам явлюсь."
55501,"И, видя смерть мою, не плачь, любезна мать."
55521,Тирану я скажу: «Клянися навсегда
55530,"И подозрением и страхом окруженный,"
55534,"Ты, конча жизнь свою, тирана страх кончаешь"
55548,"Хоть Мал злодей, но толь не может быть жесток,"
55549,Чтобы несчастную и в гробе гнати мог:
55563,"Напоминай всегда несчастнейшему сыну,"
55606,"Кто, бед под тяжестью своих не уклоняясь,"
55612,Кто недостоин жить — тот кроется во мрак.
55624,"Чтобы еще меня, несчастного, карать;"
55625,"Смерть, бедность, стыд — я всё был должен испытать,"
55629,"Роптал ли я когда, страдая и крушась;"
55675,Иль славно умереть несчастному не вольно?
55678,"Кто смерти своея страшиться не умеет,"
55683,"Я с славою паду, тирану уступая."
55696,"Постой, я слышу шум — тиран сюда идет,"
55714,Оставим тварей сих злодея обожати
55748,"Вам смерть моя нужна — погибну, не стеня;"
55752,"Забыв себя, за вас тирана поразил,"
55770,"Пятнадцать лет неся в пустынях тяжко бремя,"
55778,Во время ярости злодея сын спасенный
55794,Несчастных утешал и укрощал их стоны;
55866,(взяв жертвенную секиру и поражая тирана)
55867,"Тиран падает, а Зловред, вынимая меч, бросается на Святослава"
55868,"Мирвед вырывает меч у Зловреда, между тем стражи хотят убить Святослава."
55921,"Поэтому вы для больных великий шут, для того, что они все до смерти захахатываются."
