98536,"Да, сперва по ночам душил, а потом и днем являться стал: куда ни обернусь, все эта рожа паскудная,-- торчит, будто бы, под боком да шепчет на ухо: ""Поди, донеси, а то арестую"". И такая на меня тоска напала, такая, братцы, тоска -- ну, просто смерть! Пойду-ка, думаю, к знахарке: с уголька не спрыснет ли? Поутру сегодня ранешенько иду мимо Летнего сада, по набережной; темень, слякоть, склизко; на мостике Лебяжьем споткнулся, упал, едва ногу не вывихнул; ну, думаю, шабаш, тут меня Аракчеев и сцапает. Гляжу,-- а на снегу образок лежит малюсенький, вот этот самый,-- видите? Николай Угодник Мценский."
98543,Убить! Убить! Собаке собачья смерть! Смерть тирану!
98571,"Если вы сейчас не согласитесь идти с нами, я вас убью на месте."
98605,"Дяденька, а дяденька, грех-то какой -- ведь они его убьют?"
98606,"Убьют, Федя, не миновать, убьют."
98608,"Да что, брат, поделаешь? От судьбы не уйдешь: убили Алешеньку, убили Иванушку, убили Петеньку, убьют и Павлушку. Выпьем-ка, Федя, за нового."
98612,"Ты за что, про что калачницу убил?"
98613,"Я за то, про то калачницу убил,"
98655,"А, вот что! Думаешь, убьют. Небось, не убьют. Пусть-ка сунутся, попробуют. Ребятушек моих намедни видела, как любят меня? Коли что -- умрут, а не выдадут. Ну, да и Пален, чай, не дурак."
98665,"Нет, нет! Как вам не стыдно? Трус я, что ли? Мне ли, самодержцу, великого Прадеда правнуку, бояться этой сволочи? Взгляну -- и побегут, дохну -- и рассеются! Яко тает воск от огня, побегут нечестивые! С нами Бог! Не бойся же, Анна, и помни -- с нами Бог!"
98710,Молчи -- убью!
98754,"Я... я... я... помазанник Божий... Самодержец Всероссийский!.. Убейте, убейте!.. Не отрекусь!.. С нами Бог!.. С нами Бог!.."
98768,Бей! Смерть тирану!
98792,"Не верь, братцы, не верь!.. Убили, убили! Злодеи!.."
98816,Удержишь их! Звери! Мертвого били.
98833,Убили!
98971,"Александр опускается на ступеньки крыльца, закрывает лицо руками и плачет."
99051,(с внезапным гневом).
99064,Мария Федоровна падает в обморок. Входит Павел. За ним -- Анна.
99099,Плачет. Входит поручик Марин.
99100,"Все ждут в оцепенении. Входит Павел и, остановившись в дверях, со шляпой на голове, с тростью под мышкой, скрестив руки, тяжело переводя дыхание, глядит на всех молча. Потом подходит по очереди к Марии Федоровне, Александру, Константину и Палену, останавливается перед каждым из них и глядит в упор. Наконец возвращается к двери; вдруг, на пороге, обернувшись, высовывает язык и, громко хлопнув дверью, уходит. Мария Федоровна падает в обморок. Роджерсон приводит ее в чувство. Входит Кутайсов слева, Марин туда же уходит."
99113,Плачет и хочет броситься на шею Павла.
99125,(Отступая в ужасе.)
99164,"(Падает в кресло, плачет и смеется, как в припадке.)"
99206,"(в ужасе, падая навзничь на стул)."
99267,"Отпирается дверь. Входит Аргамаков. За ним -- Бенигсен, кн. Яшвиль, Бибиков, Татаринов, Скарятин, Николай и Платон Зубовы, с глухими фонарями и шпагами наголо."
99271,Ударом шпаги выбивает у Кириллова саблю и ранит его в руку.
99308,"Кн. Яшвиль кидается на Павла. Оба падают. На них наваливаются другие, передние -- на задних, образуя кучу копошащихся тел. Ширма опрокинута. Ночник погас. Свалка."
99310,"Раннее, еще темное утро. Потом светает."
99313,"Взбегает наверх по лестнице, спотыкается, падает, теряет туфлю, встает и бежит дальше."
99317,"Молчание, потом глухой ропот солдат."
99347,"С площади доносится стук барабанов, звуки труб, возрастающий гул голосов, крики войск. Заговорщики в смятении приходят, уходят, бегают, кричат, машут руками, указывают и заглядывают, в окна."
99397,"Шестьдесят тысяч, Прасковья глухая сказывала."
99398,"Чай, врет твоя глухая."
99565,Вы бы побольше его баловали; не до этого доживете – убьет.
99578,А вы больше покрывайте – он и не то украдет.
99600,"Грех-то у меня какой случился! Деньги папаша на базар оставил, а их кто-то взял."
99653,"Клавдинька, пойдем за ним. Уж больно он расстроился. Одна-то я боюсь."
99665,"Ждал, но не такого скандала. Я предупреждал, что придется пережить очень неприятные минуты..."
99708,Скатерть грязная.
99798,"Кушайте одни. Сам-то лег, уж больно расстроился. Компресс ему на голову положила, успокоительных капель дала."
99877,"Плачет папаша, просит его на Распоповой жениться, а он не хочет."
99885,"Нет, неправда это. Он злой; все только для себя одного делает."
99900,"Не надо. И не говори им ничего про меня. Несчастные, все несчастные!"
99902,"Не обойдется... нельзя, чтобы обойтись... Души у них у всех несчастные."
99984,"Довольно, оставь свои жалобы!"
100041,"Да какая жизнь здесь? За эти две недели, что я у вас, я измучилась... Вечно сознавать и чувствовать, что ты здесь лишняя, в тягость... Это ужасно! А потом эти постоянные ссоры то из-за одного, то из-за другого..."
100045,"Я мешаю жить? Мне кажется, последняя прачка не возвратилась бы к такому хаму."
100111,"Не могу. Я только буду просить вас позволить мне уехать отсюда. Дайте мне на первое время денег, и я больше не буду вас беспокоить ничем. Вот что я решил."
100395,"Повторяю, я мог бы не рассказывать, если бы не был уверен в тебе, но я счел своим долгом рассказать... да притом... я боюсь... слухи и сплетни постоянно искажают факты..."
100500,"(С сожалением посмотрев на них, уходит в спальню.)"
100523,"Пауза. Алеша пьет чай; Арина Ивановна садится против него, с сожалением смотрит и укоризненно качает головой."
100524,(плачет).
100627,"Алексей вбегает наверх. Ванюшин догоняет его и, спотыкаясь на лестнице, убегает за ним. Из-за стола все встали. Аня и Леночка хотели было бежать наверх, но остановились на лестнице. Все чего-то ждут и прислушиваются. Сверху слышен голос Алексея: ""Оставьте! Я не позволю, не позволю!"" Падает что-то тяжелое, должно быть, стул. Через некоторое время Алексей показывается на лестнице. Волосы его растрепаны; от мундира оторвалось несколько пуговиц."
100721,"Из зала выходит Красавин, он мрачен после похмелья."
100775,"(С ней истерика, плачет и хохочет в одно и то же время.)"
100920,(глухим голосом).
100921,"Константин делает шаг вперед и с искаженным от ужаса лицом смотрит на труп; Арина Ивановна остолбенела на месте; лицо Клавдии подергивают судороги; Аня сейчас вскрикнет и упадет в обморок. Кукарникова и Инна, недоумевая, глядят друг на друга. Страшная пауза. Еще момент – и трагедия их душ воплями и стонами вырвется наружу."
100936,"Теперь совсем не то... меня узнать нельзя... я стал и стар, и слеп, и слаб."
101219,"Я совсем не стара... совсем не дурак... он толкай меня, о... разбил мой Наполеон... мой Вольтер... нога сломай Тальони... ну куда без ноги годитсь Тальони... возьмите себе... Вольтер... Деньга подай, деньга за мой бюсты!"
101225,"Что... вы ругай... не карашо, синьор, ругать честна итальянец... Я не дурак! Не пуста голова."
101289,"Ах, папенька... Я услышала голос моего Валерьяна... он почти плачет..."
101347,За кулисами слышен шум от падения бюстов.
101420,"Лишь вы зато читать мне не мешайте,"
101475,Умрешь там с голоду...
101483,Могу я умереть со скуки;
101530,"Мне тяжко, скучно, я страдаю..."
101635,И не без злых!
101644,"Ах, горе, горе! мы его лишились."
101648,"Везде искала - нет! О, страшное сомненье"
101734,(плачет)
101735,Плачут отчаянно.
101855,"Я, несчастный ювелир."
101893,"Родитель мой, страдая, изнывал,"
101977,"Насилу выговорил! Точно ему жаль слова-то было! Вы можете получить у меня все, что угодно, только предупреждаю, что я в долг не даю ни на гривенник, ни... около того..."
102093,Но дождутся злого году...
102150,"Вот тебе того, вот тебе около того! Как я сплошал... Где я? у воров или у барона?.. Если у него, то он уже должен быть в третьем градусе сумасшествия, когда такую штуку затеял... нет, уж это не шутка! Все ушли, ни тут, ни около того ничего не слышно... может быть, меня зарезать хотят... Нет, я не могу оставаться один; что будет -- только бы скорее к концу... Эй, люди! Откликайтесь, эй, эй!"
102160,"Всё кончено, около того... я отравлен... фу! как гадко... около того... Какой вы мне горечи поддали!"
102164,Я сумасшедший!
102225,"Какой он мне племянник... выходит, он просто, около того... мошенник."
102289,Какой же сумасшедший сделал бы это!
102292,И всё это наделала эта недостойная женщина... около того...
102485,(плачет).
102518,"Не ведьмы-то не ведьмы, вижу я."
102538,"Я на него лет десять убивал,"
102582,"Отец! отец! оставь угрозы,"
102587,"Когда еще, и глуп и мал,"
102594,"А в бурсе... Там, от боли воя,"
102656,"Позор — вот мысль моя!"" —"
102700,Пьян напивался раз.
102719,"Что темных дел показывать,"
102729,Во все их тайны грязные
102775,И горечь непомерную
102967,(Падает в изнеможении на копну сена и остается с закрытыми главами и бледным лицом. Слышны звуки охотничьих рогов.)
103044,"Пьяница, груб, дерзок."
103169,Уф! Я теперь дрожу от будущего шуму.
103181,"И я чего боюсь, чтоб наш рифмач, в досаде,"
103190,"Кто ж в ней мешает нам, того мы ненавидим."
103205,"Ах, нет! Беги... Скажи, чтоб он оставил вздор,"
103206,Оставил бы свое намеренье пустое.
103243,"Мой страх прошел, равно, надеюсь, и беда."
103265,Этой уж беды не будет в свете злее.
103283,Мешает мне успеть в намереньях моих.
103322,Вот и наш Модстрих несчастный.
103331,"Оставь меня, глупец!"
103370,Не будет никому ни малой в том потери.
103406,"Не должен восхвалять, в царе пороки зря,"
103425,И что за мысль пришла трагедию казать?
103530,Несчастный богатырь!..
103739,Везде ошибок тьма... нельзя понять никак...
103741,"А ты, дурак, пришли... коррекцию иную."
103927,"К Надмену он прилип, и мы навек несчастны."
103953,"Послушайте, иль глухи?"
103971,Чтоб приняли вы труд трагедию прочесть.
103988,"Трагедии писать ничуть, ничуть не шутка."
104006,Когда б воображал в трагедии твоей
104016,Кто ж спорит? Золото в грязи узнать нетрудно.
104050,Трагедией своей в сравненье был мне годен?
104065,"Россия, удержи такое преступленье!"
104080,Когда бы не принес трагедию свою...
104127,"Что ты пристал к безумцам... дуракам,"
104148,Трагедией зовет? при мне!.. при мне!.. никак!
104151,А я трагедии... сей мерзости твоей...
104174,"Теперь и сам беду увидел, но уж поздно."
104191,"Уж подлинно беда! большое обвиненье,"
104310,Пришлите мне свою трагедию скорей.
104356,"Выдумывает ложь, выводит клеветы,"
104360,"Всё видит, знает всё: где ссора, где развод,"
104362,"Кто, выучась с вином мешать искусно воду,"
104401,То трудно было бы несчастных перечесть!
104425,"И, взяв трагедию, спеши назад как можно,"
104449,Какая ж в том беда? обижен ли ты тем?
104483,"Чудак, ей-ей!.. вранья чужого не видал,"
104509,"Куды с копытом конь, туды с клешней и рак."
104518,Поэтому себя ты очень ненавидишь?
104610,Нашли ль трагедию?.. пора бы к делу нам.
104639,"Вот вам трагедия, с трудом ее нашла."
104732,"Обманом уловить самолюбивый нрав,"
104835,Когда трагедию тебе я покажу.
104860,"Чтоб ты из дурака, на модах зараженна,"
104892,Вранье и бред... твои обыкновенны свойства.
105147,(вынимает трагедию)
105367,"Близ двух веков, враги то явные, то скрытны,"
105374,И рассевала вкруг уныние и страх;
105380,"Отторглись от нея; но алчные тираны,"
105388,Смутился сердцем он и мыслью впал в сомненье;
105400,"Главы сложили в гроб изменою неверных,"
105480,"Ах, лучше смерть в бою, чем мир принять бесчестный!"
105502,Сим рабством ли беды мы можем отвратить?
105572,Для мести нам Батый оставил вечный след.
105590,Оставь его безумство!
105600,В крови врагов омыть прошедших лет позор
105618,Смятенье принесем для них внезапным боем
105622,Должны ль сокрыты быть в покровах ночи мрачной?
105654,Не плакал о бедах Российского народа?
105707,"Когда б не видел в ней несчастнейших последствий,"
105739,"Болезнь медлительна, в груди носима ею,"
105774,И горесть мрачная в чертах твоих видна.
105786,Чтоб ярости моей не предался достойно!
105796,Но завтра бой... конец мучениям моим.
105806,"Приезд в Задонский стан - последний долг покорства,"
105858,Но у меня ее отъяла смерть сурова.
105860,И беззащитную оставила ты дочь!
105867,Того мне строгий долг забыть повелевает.
105874,"Ах, нет: доднесь еще толь мрачныя печали"
105878,"Тот день, в который долг мне повелит стараться"
105921,"Жестокости твоей того не доставало,"
105933,"Против тиранов стать бесчувственных, суровых,"
105935,"И горе будет им! Так, в ярости моей,"
105943,"Явить татарам здесь отечества позор,"
105953,И слышишь ныне мне Димитрия угрозы:
105959,"Хотя несправедлив, тебе ли обвинять?"
105962,"Но сколь ты сам неправ, сколь ты жесток, познай..."
105963,"Тверский сюда идет, умеря гнев, внимай!"
105990,Врагам предвестник был дней горестных и мрачных.
105996,Я снова поклянусь в вражде против татар!
106066,"И завтра, с бою сшед, здесь брачный храм поставлю;"
106110,Одну ль мою несу я завтра в бой судьбину?
106143,"В шатер Димитрия, кого я ненавижу,"
106154,"Могла, забывши долг, прельщенна быть другим,"
106155,"Коль, сердцем неверна и мыслью малодушна,"
106166,И на чертах следы б отлились горьких слез.
106174,Воображал бы их и ими бы страдал.
106178,Но в грудь Димитрия пролью мученья ад.
106179,"А вы, в моем лице все ныне оскорблении,"
106182,"Конечно, сам Мамай, жестокий Россов враг,"
106187,"Ордынцев в алчности, горя любостяжаньем,"
106208,"Гнетящий их главы, несчастно разделенны."
106220,"Ни степи дикия, вокруг неизмеримы,"
106242,И данником его с позором отступать.
106247,"Не изменив отцам несчастно убиенным,"
106341,"И нам, отечеству и долгу изменяя,"
106342,"Бежит, как робкий вождь, от ярости Мамая."
106381,В сраженьи смерть найдешь и в бегстве гибель равну.
106387,Влачите на себе неволю и позор!
106427,"С печалию в душе, с позором на челах,"
106442,"Коль, смерть в бою приняв, возмог бы жизнью новой"
106449,"И вам, колеблемым сомненьем неизвестным,"
106454,И мстивши умереть.
106478,Что прийдут сироты и горестны вдовицы
106485,Оставить можешь ты в погибели меня.
106491,"И пропасть, под тобой лежащу, указали."
106500,"Погибнем вместе мы среди врагов в бою,"
106504,Что неизбежна смерть в сраженьи предлежит?
106519,Под гневом Ксении несчастно умирая.
106536,"Кровавой битвы час, и Бренский мне ответа"
106580,И с шумом память их погибнет нечестива!
106604,"Умрем, коль смерть в бою назначена судьбою;"
106645,"Что в бой, на верну смерть стремишься ты один,"
106655,"И смертью витязей, и страхом смерти близкой,"
106659,"Коль обещаешь мне, отвергнув мысль жестоку,"
106670,И яростный Мамай в побеге унесет
106672,Разбития позор и казнь своей гордыни!
106697,Я ныне более должна еще страдать.
106730,Мне благом будет смерть: она конец печали!
106744,"И тайную печаль, и тайну сердца муку"
106763,"Конечно, тень ее страдает вкруг безмолвно"
106784,Соединитесь вновь к изглаженью позора
106794,"Простить обиды все, идти в кровавый бой,"
106802,Будь мене жалостлив иль менее жесток!
106839,"Жестокий князь, постой!"
106868,Рази и в ярости законы все забудь!
106874,И враг его Мамай нас в битву вызывает.
106886,"Друг смертью похищен, и смерти он не верит."
106919,А я опасностей и смерти лишь желаю.
106938,Чтоб их кровавых рук убийственный удар
106941,"Ужель известна ты, что он в бою убит,"
106945,"И дикий крик татар, которых нагло зверство"
106947,Преследует мечом несчастных россиян;
106951,"День злополучнейший из всех несчастных дней,"
106954,"Но чем виновна ты? Иль жертва та мала,"
106972,"О, мысль жестокая! И я не умираю!"
106973,От смерти и татар из стана убегаю!
106978,Конечна гибель нам? Неистовый Мамай
106979,Порабощает ли несчастный Русский край?
107016,"Пред ними страх бежит, и с ними смерть летает,"
107024,Все шесть смертей душе отцовской нанесенны;
107067,Мамай издалека смерть видел Челубея
107094,"Быть может, раненный, средь мертвых он упал"
