159950,"Где скрою омерзение к жестокой судьбе моей? Был ли кто столько гоним ею, как несчастный Согдай? Боже! Боже! Расторгни бытие мое!.. или... если должно мне сносить, то преврати мои мысли, сердце и разум в камень, дабы я не мог чувствовать раскаленных стрел, меня поражающих... Царь! К тебе прибегаю. Если ты не хочешь спокойствия на престоле твоем, если не хочешь спасать подданных твоих, если пролитие крови их тебя услаждает, если ты алчешь преклонить свою голову под пяту гордого разбойника, не принимай меня, не давай мне оружия, но не предавай меня в руки общего нашего врага. У ног твоих прошу тебя... Почувствуй стыд мой, вели пронзить грудь мою. Неужели нет в природе существа, кого бы я умолить мог отнять у меня жизнь?"
159959,"Грубей! Унылый твой вид меня ужасает. Скажи, что сделалось?"
159963,Казнь! Неужели гнусная измена?..
159970,"Ежели он ушел к царю... он может много сделать нам вреда. Согдай, быв с нами и пользуясь всею возможною вольностию, вызнал все наше положение, он может открыть все царю."
159971,"Грубей! Стыдись, что ты занимаешься ничтожным Согдаем. Какая нужда царю узнавать от беглеца наше положение, когда ему знакомы все тропки вкруг его столицы? Число казаков давно уже царю известно, оно не много больше было, когда мы решились напасть на бесчисленные орды его царства. Ты не робел тогда... а теперь..."
159984,Я страдал за тебя... теперь не уйдешь.
159988,Дерзкий! Ты смел поднять руку на жизнь безоружного? Ты дерзнул без моего повеления обнажать железо? Чудовище! Гнусный разбойник! Ты не можешь быть терпим в моем войске. Смертная казнь будет возмездием за злодеяние. Грубей! Сей час исполни мое повеление.
159991,"Постойте... Ермак! Смерть моя близка! Льющаяся кровь моя возвещает мне, что я недолго буду тяготить собою землю. Поражен оковами от Кучума, я потерял все чувства, и язык мой лишился употребления; но текущая кровь прохладила во мне огнь исступления... Я говорю с тобою в последний раз... Померкающий луч моей жизни живо теперь представляет мне, что я не умел чувствовать твоих ко мне благодеяний; пылкость юности моей изображала мне их в оскорбительном виде... Не презри меня в сии минуты; молю тебя, исполни мое прошение."
159995,"Так ты не хочешь усладить миг смерти моей? Жизнь моя, тягостная всем и самому мне, прекращается... Увы! Когда я желал смерти, я не думал, что она была столь горька. Ты всегда был великодушен; ты прощал мне все, а теперь не хочешь простить мне моей смерти!.. Казнь моего убийцы поколеблет во гробе прах мой... Ах, не делай памяти моей ненавистною."
160006,"Лейтесь, лейтесь, горестные слезы! Вы прохлаждаете грудь мою! Грудь, которая никогда не трогала жалость при виде тысячи смертей... а теперь я дрожу... Согдай умирает... голос его... какой ужасный голос! Он будет жить вечно в душе моей. Это ты... ты, гнусное чудовище! Твоя рука пронзила грудь собрата своего. Отвечай мне!.. С кем я хочу говорить? Беги от глаз моих... земля трясется под тобою... Удалите его... или нет! Стой передо мною, гнусный злодей! Пронзай сердце мое проклятым твоим взором. Ах! Я вижу на руке его запекшуюся кровь. Прочь, прочь, мерзкий убийца! Не встречайся мне никогда... Я убью тебя одним взглядом моим."
160007,"Я один... никого нет со мною... Какой ужасный бой со всех сторон ударяет в слух мой! Кто послал тебя сражаться с татарами? Кто велел тебе покорять их царю твоему?.. Кто смеет меня спрашивать о том? Тысячи голосов со всех сторон твердят одно и то же... Кто?.. кто?.. кто? Мщение! Мщение!.. Я должен был спасать жизнь мою... Но разве в тысячи смертях неведомых тебе народов включено спасение твоей жизни? Может быть, и царь твой возгнушается твоими победами и будет проклинать победителя... О ужасная мысль! Куда я скроюсь от тебя? Ты вселяешь внутрь меня вечный ад!.. Ермак! Опомнись... обрати мысль свою к Богу... Нет под солнцем ничего, что укрывалось бы от промысла Всевышнего... Может быть, сим путем Он захотел очистить оскверненную идольскими жертвами землю... Боже всесильный! Ежели ты избрал меня орудием твоим... пощади людей твоих... я всегда молил тебя о том."
160018,"Нет, судьба пощадит тебя: она столько удручала жестокостию своего Согдая, что не поразит меня последним сим ударом; она устыдится толико слабой жертвы. Надобно ли столь жестокому быть удару, чтоб расторгнуть бытие мое, когда малейшее мановение может отнять у меня жизнь."
160045,"Я ничего не вижу... туман скрывает от глаз моих все предметы... страшный шум вокруг меня... Нарсим! Что здесь происходит?.. Никто не отвечает!.. Скажите мне, где я?.. чья рука держит мою голову?.. где мой меч? я не помню ничего. Кто здесь?"
160053,"Утешение! Разве может безотрадная горесть принимать его? Разве палимая смертною тоскою душа моя может чем-нибудь прохладиться? Кучум! Ты повержен в прах... Грудь твою терзает, как лютый вран, стыд и отчаяние! У тебя все отнято! Победитель, как разъяренный лев, рыкает в бездушном твоем царстве. Он ревом своим устрашает всю природу и обагренными кровию когтями раздирает свою добычу. Но где Ирта?.. где дочь моя? скажи мне, погибла она или еще жива?.. Нет, не говори мне об ней ничего, я боюсь услышать об ее жребии... Смотри, она рассечена на части, дымящаяся кровь ее обагряет замерзлую землю... плотоядные волки пожирают ее тело... Пожрите и меня с нею, разорвите меня на части, вырвите запекшееся мое сердце. Ад, поглотивший супругу мою! Разлей пламя свое по всему царству моему и пожги в нем все, что имеет еще жизнь и дыхание."
160054,"Не избежишь смерти, дерзкий юноша! Затрепещешь в крови своей. Ты замедлил только победу мою. Что я вижу? Ирта!"
160151,(входя с видом мрачным)
160268,"Что такое помнить? Берегись ты, чтоб после самому не плакать, ведь у тебя одна и есть дочь. Каково тебе будет смотреть на её горючи слёзы? Жить с постылым мужем хуже каторги."
160423,"Нет, к чёрту, помешал мне спать. Я испугался, думал, что чёрт возится."
160556,"Княгиня, подозрением своим вы разбудили в груди моей змею, давным-давно уснувшую! Я стражду, я мучусь, я требую объяснения!"
160562,"Но, рассудите сами, кто кого затронул? Вы первая оскорбили меня подозрением."
160584,Оставьте мою шляпу! Это моя шляпа!
160591,"Боже, какое тиранство! Нет, это не муж, это кровожадный леопард!.. Пользуйтесь правом сильного; это очень, очень мило! Не знаю только, кого изберете вы своею жертвой? ибо что принадлежит до меня, то я завтра же оставляю дом этот, и мы с вами больше не увидимся!"
160666,"В это время барон, стоявший за портьерой, роняет стул, на котором лежала шляпа князя, и поспешно убегает. Шляпа подкатывается к ногам княгини. Князь и княгиня в испуге оборачиваются."
160678,(Падает в обморок.)
160719,"Прими же тьмы проклятий,"
161009,(Отталкивает его и сама отступает с отвращеньем.)
161042,(плачет)
161047,"(Падает снова на стул, в изнеможении.)"
161056,"Комната первой картины.— Шишкенгольм, Мина Христиановна, Лиза, Фриц, Густав почти выбегают из правой половины, преследуемые Касимовым и Вихориным. В это же время Иванов входит робко в среднюю дверь и остается неподалеку от нее, у задней стены. Мина Христиановна, запыхавшись, падает в вольтеровское кресло."
161063,"(усталая, падает в кресло, отмахиваясь платком, и говорит сдобным голосом)"
161289,"Что ты будешь делать?! Барыня изволит плакать, изволит сердиться, из себя выходит; изволит орать во всю глотку: «Дайте мне мою моську! где моя Хвантазия?» Хвантазия!.. А, Хвантазия!.."
161327,"Это моя собака — Фантазия, и вовсе не темная, а светло-желтая!.. Она пропала, она убежала, ее похитили!"
161488,"Ну, положим, игрушка. Эка беда?.. Разве я какой взяточник, чтоб на живых собак деньги тратить? А ведь это подло: вы же присоветовали!"
161516,Кто это?.. Зачем я здесь?.. Отчего я мокра?! Что со мною хотели сделать?! Собачка моя! моська моя!.. Это не обман?
161671,(Плачет.)
161755,(Целует моську и плачет.)
161771,"(Падает, споткнувшись; встает, плюет на то место, где упал, и затем выбегает на авансцену, показывая всем моську.)"
161773,(Бросает моську Беспардонного и падает в сбморок.)
161774,"(Падает в обморок возле Чупурлиной, но в другую сторону.)"
161819,"Нет, не Кавтыревым! Кавтырев мне свояк. С ним действительно был случай; но он на дуэли не убит, а просто упал с лошади, гоняя ее на корде вокруг павильона на даче Мятлева. При этом еще он вывихнул безымянный палец, на котором носил чугунный перстень с гербом фамилии Чапыжниковых."
161930,Плачу под звук тетрахордин.
161997,Всеобщий бред... Все лезет вон из нормы!..
161998,"Пусть без меня придут: потоп и трус,"
162089,"(очнувшись, в тревожном раздражении)"
162112,(скрывая смущение под гневом)
162128,"(Стоит в раздумье, и взор его падает на убитую дубом полевую мышь.)"
162179,Зачем же ты его не уничтожил?
162195,В глухой тюрьме тихонько б задавили.
162203,Ему ступить мешает на престол.
162317,"А за грехи, за темные деянья"
162337,О темном ли владычестве татар?
162347,"Не ведая ни жалости, ни гнева."
162381,"Зачем и мне не тешиться в боях,"
162428,"Его душе, страдающей и бурной."
162451,"О страшное, невиданное горе!"
162461,Кровавый грех. Тогда я в дальний Углич
162477,Укрывшихся злодеев захватили
162506,А между тем отшельник в темной келье
162514,"Уж эти мне грамотеи! Что еще выдумал! буду царем на Москве! Ах он сосуд диавольский! Однако нечего царю и докладывать об этом; что тревожить отца-государя? Довольно будет объявить о побеге дьяку Смирнову али дьяку Ефимьеву. Этака ересь! буду царем на Москве!.. Поймать, поймать врагоугодника, да и сослать в Соловецкий на вечное покаяние. Ведь это ересь, отец игумен?"
162558,"Меня, меня, несчастного отца!.."
162559,"Кто ни умрет, я всех убийца тайный:"
162567,"Над злобою, над темной клеветою."
162570,Тогда беда: как язвой моровой
162621,"Плохо, сыне, плохо! Ныне христиане стали скупы; деньгу любят, деньгу прячут. Мало Богу дают. Прииде грех велий на языцы земнии. Все пустилися в торги, в мытарства; думают о мирском богатстве, не о спасении души. Ходишь, ходишь; молишь, молишь; иногда в три дни трех полушек не вымолишь. Такой грех! Пройдет неделя, другая, заглянешь в мошонку, ан в ней так мало, что совестно в монастырь показаться; что делать? с горя и остальное пропьешь; беда да и только. — Ох, плохо, знать пришли наши последние времена…"
162627,"А вот что: из Москвы бежал некоторый злой еретик, Гришка Отрепьев, слыхал ли ты это?"
162629,Не слыхал? Ладно. А того беглого еретика царь приказал изловить и повесить. Знаешь ли ты это?
162646,"«Чудова монастыря недостойный чернец Григорий, из роду Отрепьевых, впал в ересь и дерзнул, наученный диаволом, возмущать святую братию всякими соблазнами и беззакониями. А по справкам оказалось, отбежал он, окаянный Гришка, к границе Литовской…»"
162751,Правительством подкупленные воры.
162754,Вот — Юрьев день задумал уничтожить.
162915,От ужаса во гробе содрогнется.
162936,Всё снилося убитое дитя!
163109,Перед собой вблизи видал я смерть;
163175,"В глухой степи, в землянке бедной — ты,"
163254,"Уж если ты, бродяга безымянный,"
163504,И злой обман бродяги обнаружу.
163555,Подать ему милостыню. О чем он плачет?
163557,"Поди прочь, дурак! схватите дурака!"
163649,Он лег на поле смерти.
163809,И темный гроб моею будет кельей.
163853,"Что казаки лишь только села грабят,"
163868,И раздувать холодный пепел брани:
163913,Под властию жестокого пришельца:
163948,"В самом деле? Слышишь, какой в доме шум! Тревога! дерутся!"
163950,Народ! Мария Годунова и сын ее Феодор отравили себя ядом. Мы видели их мертвые трупы.
163986,(плачет)
164076,(плачет)
164148,Семья убитого...
164186,"Муж у нее был негодяй суровый,"
164211,Убитого... не помню кем?
164231,И плакать.
164361,"Блестит на синеве густой и темной,"
164465,"У вас, сеньора. Может, я мешаю"
164527,Страдать в безмолвии...
164556,Утешили несчастного страдальца.
164640,Все помню я свою потерю. Слезы
164701,Вы ненавидеть станете меня.
164735,Я убил
164757,"На совести усталой много зла,"
164768,Вы сущий демон. Сколько бедных женщин
164781,И ваша смерть была бы неизбежна.
164789,Ах если б вас могла я ненавидеть!
164905,"Пленить умел слух диких парижан,"
164968,И слушать скрыпача слепого! – Боже!
165016,"Быть может, мнил я, злейшего врага"
165017,"Найду; быть может, злейшая обида"
165090,Ты плачешь?
165128,(Бросает яд в стакан Моцарта.)
165178,Роща темная пуста;
165215,"И мрачный год, в который пало столько"
165238,Она и расстоналась. Ненавижу
165246,"Сестра моей печали и позора,"
165295,"И бездны мрачной на краю,"
165340,"Иль думаешь, она теперь не плачет,"
165376,"Он сумасшедший, —"
165461,Меня пустым жестоким ожиданьем?
165463,Каким себя я страхом не пугала?
165519,Иль на войне — войны я не боюсь —
165522,Или со мной пустую шутку шутишь.
165593,"Небось, подманивать, божиться, плакать"
165711,"Княгиня душенька, не плачь, не бойся,"
165778,"И дикий зверь, и лютый человек,"
165812,"Поблекнув, вдруг свернулися и с шумом"
165827,"Несчастный, он помешан. Мысли в нем"
165859,"Иль с голоду умрешь, иль зверь тебя"
165876,Старик несчастный! вид его во мне
166004,"Пробит насквозь, испорчен. Невозможно"
166024,"А нынче что скажу? О бедность, бедность!"
166149,"Без тошноты, без боли умирает."
166150,Твой старичок торгует ядом.
166232,"Обманов, слез, молений и проклятий"
166241,Что мужнин долг она мне принесла
166254,Не страх (о нет! кого бояться мне?
166302,"Заимодавец грубый, эта ведьма,"
166306,"А там посмотрим, станет ли несчастный"
166314,"Стыд горькой бедности. Когда б не крайность,"
166365,Он дикого и сумрачного нрава —
166383,В пороках низких...
166398,За злое преступленье.
166406,Хотел убить.
166436,"Вы, старик несчастный,"
166548,"Нет, нет, не бойся; а хоть и случится такой грех – что за беда? – не все ж конюшие убиты до смерти."
166577,"Франц, разве ты глух?"
166596,"Вот наш домик.... Зачем было мне оставлять его для гордого замка? Здесь я был хозяин, а там – слуга... и для чего?.. для гордых взоров наглой благородной девицы. Я переносил унижения, я унизился в глазах моих – я сделался слугою того, кто был моим товарищем, я привык сносить детские обиды глупого, избалованного повесы... я не примечал ничего... Я, который не хотел зависеть от отца, – я стал зависим от чужого... И чем это всё кончилось? – боже... кровь кидается в лицо – кулаки мои сжимаются... О, я им отомщу, отомщу..."
166697,"Восклицал он, дик и рьян,"
166719,"Конечно – песня песнию, а веревка веревкой. Одно другому не мешает."
166723,Нельзя ли помиловать этого бедного человека?.. он уже довольно наказан и раной и страхом виселицы.
166756,"Лошади раненые падают с седоками, другие бесятся."
166786,Неумолимое презренье! - Ты
166823,"Вражду и ложь со злобой потаенной,"
166826,"Видала я обман под рукожатьем,"
166827,Измену под улыбкой... Горько было
166843,"И злы и дурны,- зол и дурен свет..."
166863,"Забывшим, обманувшим, оскорбившим -"
166923,"С приезда твоего; и стар и мал,"
167069,"До крайности, донельзя, до безумья..."
167079,Голодной смертью умирал я...
167136,"И пуст и мрачен, будто заколдован,"
167462,"Меня не беспокоите. Болтайте,"
167537,"Капризный слух, не доходя до сердца!"
167549,"И про тоску, и про обман коварный..."
167655,О черте!.. Бойтесь бога вы!
167736,"Все плакала она, все запиралась..."
167786,"Дика, уединенна и странна..."
167833,Что такое? Кто здесь плачет? кто бранится?..
